ID,Article Title,prediction type,dependency,Publication Year,Source Title,JCR,CAS,mID,metrics,suit,category
1,Predicting aging-related bugs using software complexity metrics,Inter-release,defect-prone,2013,PERFORMANCE EVALUATION,3,4,118,LOC,Code,traditional
2,Influence of confirmation biases of developers on software quality: an empirical study,Inter-release,defect-density,2013,SOFTWARE QUALITY JOURNAL,3,4,118,LOC,Code,traditional
3,A fuzzy classifier approach to estimating software quality,Intra-release,module quality,2013,INFORMATION SCIENCES,1,1,118,LOC,Code,traditional
3,A fuzzy classifier approach to estimating software quality,Intra-release,module quality,2013,INFORMATION SCIENCES,1,1,118,LOC,Code,traditional
6,Software defect prediction using Bayesian networks,Intra-release,defect-prone,2014,EMPIRICAL SOFTWARE ENGINEERING,2,2,118,LOC,Code,traditional
7,Two-Stage Cost-Sensitive Learning for Software Defect Prediction,Intra-release,defect-prone,2014,IEEE TRANSACTIONS ON RELIABILITY,1,2,118,LOC,Code,traditional
8,Predicting software defects with causality tests,Inter-release,defect-prone,2014,JOURNAL OF SYSTEMS AND SOFTWARE,2,2,118,LOC,Code,traditional
10,The Use of Ensemble-Based Data Preprocessing Techniques for Software Defect Prediction,Inter-release,defect-prone,2014,INTERNATIONAL JOURNAL OF SOFTWARE ENGINEERING AND KNOWLEDGE ENGINEERING,4,4,118,LOC,Code,traditional
11,An empirical study on software defect prediction with a simplified metric set,Inter-release/Cross-project,defect-prone,2015,INFORMATION AND SOFTWARE TECHNOLOGY,2,2,118,LOC,Code,traditional
14,Improving Recall of software defect prediction models using association mining,Intra-release,defect-prone,2015,KNOWLEDGE-BASED SYSTEMS,1,1,118,LOC,Code,traditional
15,An empirical analysis of package-modularization metrics: Implications for software fault-proneness,Intra-release,defect-prone,2015,INFORMATION AND SOFTWARE TECHNOLOGY,2,2,118,LOC,Code,traditional
16,An Empirical Investigation on Wrapper-Based Feature Selection for Predicting Software Quality,Intra-release,defect-prone,2015,INTERNATIONAL JOURNAL OF SOFTWARE ENGINEERING AND KNOWLEDGE ENGINEERING,4,4,118,LOC,Code,traditional
18,Software defect prediction using ensemble learning on selected features,Intra-release,defect-prone,2015,INFORMATION AND SOFTWARE TECHNOLOGY,2,2,118,LOC,Code,traditional
21,Developer Micro Interaction Metrics for Software Defect Prediction,Intra-release,defect-prone,2016,IEEE TRANSACTIONS ON SOFTWARE ENGINEERING,1,1,118,LOC,Code,traditional
22,Deriving thresholds of software metrics to predict faults on open source software: Replicated case studies,Inter-release,defect-prone,2016,EXPERT SYSTEMS WITH APPLICATIONS,1,1,118,LOC,Code,traditional
23,A new fuzzy rule based algorithm for estimating software faults in early phase of development,Intra-release,defect-number,2016,SOFT COMPUTING,2,3,118,LOC,Code,traditional
25,Empirical analysis of network measures for predicting high severity software faults,Inter-release/Cross-project,defect-prone,2016,SCIENCE CHINA-INFORMATION SCIENCES,1,2,118,LOC,Code,traditional
27,SAMPLING IMBALANCE DATASET FOR SOFTWARE DEFECT PREDICTION USING HYBRID NEURO-FUZZY SYSTEMS WITH NAIVE BAYES CLASSIFIER,Intra-release,defect-prone,2016,TEHNICKI VJESNIK-TECHNICAL GAZETTE,4,4,118,LOC,Code,traditional
28,Empirical Studies of a Two-Stage Data Preprocessing Approach for Software Fault Prediction,Intra-release,defect-prone,2016,IEEE TRANSACTIONS ON RELIABILITY,1,2,118,LOC,Code,traditional
29,The Use of Summation to Aggregate Software Metrics Hinders the Performance of Defect Prediction Models,Intra-release,defect-prone/defect-number/defect-severity,2017,IEEE TRANSACTIONS ON SOFTWARE ENGINEERING,1,1,118,LOC,Code,traditional
30,An empirical analysis of the effectiveness of software metrics and fault prediction model for identifying faulty classes,Intra-release,defect-prone,2017,COMPUTER STANDARDS & INTERFACES,1,2,118,LOC,Code,traditional
31,A Combined-Learning Based Framework for Improved Software Fault Prediction,Intra-release,defect-prone,2017,INTERNATIONAL JOURNAL OF COMPUTATIONAL INTELLIGENCE SYSTEMS,3,4,118,LOC,Code,traditional
32,A feature selection approach based on a similarity measure for software defect prediction,Intra-release,defect-prone,2017,FRONTIERS OF INFORMATION TECHNOLOGY & ELECTRONIC ENGINEERING,2,3,118,LOC,Code,traditional
34,Software bug prediction using object-oriented metrics,Cross-project,defect-prone,2017,SADHANA-ACADEMY PROCEEDINGS IN ENGINEERING SCIENCES,3,4,118,LOC,Code,traditional
35,A Cluster Based Feature Selection Method for Cross-Project Software Defect Prediction,Cross-project,defect-prone,2017,JOURNAL OF COMPUTER SCIENCE AND TECHNOLOGY,3,3,118,LOC,Code,traditional
36,A dimensionality reduction-based efficient software fault prediction using Fisher linear discriminant analysis (FLDA),Intra-release,defect-prone,2018,JOURNAL OF SUPERCOMPUTING,2,4,118,LOC,Code,traditional
37,Empirical analysis of change metrics for software fault prediction,Intra-release/Inter-release,defect-prone,2018,COMPUTERS & ELECTRICAL ENGINEERING,2,3,118,LOC,Code,traditional
38,A Framework for Software Defect Prediction and Metric Selection,Intra-release,defect-prone,2018,IEEE ACCESS,2,3,118,LOC,Code,traditional
39,A novel software defect prediction based on atomic class-association rule mining,Intra-release,defect-prone,2018,EXPERT SYSTEMS WITH APPLICATIONS,1,1,118,LOC,Code,traditional
40,Software bug prediction using weighted majority voting techniques,Inter-release,defect-prone,2018,ALEXANDRIA ENGINEERING JOURNAL,1,3,118,LOC,Code,traditional
42,Towards a Reliable Identification of Deficient Code with a Combination of Software Metrics,Intra-release,defect-prone,2018,APPLIED SCIENCES-BASEL,2,4,118,LOC,Code,traditional
43,The Empirical Study of Semi-Supervised Deep Fuzzy C-Mean Clustering for Software Fault Prediction,Intra-release,defect-prone,2018,IEEE ACCESS,2,3,118,LOC,Code,traditional
44,Deep neural network based hybrid approach for software defect prediction using software metrics,Intra-release,defect-prone,2019,CLUSTER COMPUTING-THE JOURNAL OF NETWORKS SOFTWARE TOOLS AND APPLICATIONS,2,4,118,LOC,Code,traditional
45,Software defect number prediction: Unsupervised vs supervised methods,Intra-release/Inter-release/Cross-project,defect-number,2019,INFORMATION AND SOFTWARE TECHNOLOGY,2,2,118,LOC,Code,traditional
48,Software defect prediction techniques using metrics based on neural network classifier,Intra-release,defect-prone,2019,CLUSTER COMPUTING-THE JOURNAL OF NETWORKS SOFTWARE TOOLS AND APPLICATIONS,2,4,118,LOC,Code,traditional
49,Performance Analysis of Feature Selection Methods in Software Defect Prediction: A Search Method Approach,Intra-release,defect-prone,2019,APPLIED SCIENCES-BASEL,2,4,118,LOC,Code,traditional
50,An empirical study on pareto based multi-objective feature selection for software defect prediction,Intra-release,defect-prone,2019,JOURNAL OF SYSTEMS AND SOFTWARE,2,2,118,LOC,Code,traditional
52,Feature selection using firefly algorithm in software defect prediction,Intra-release,defect-prone,2019,CLUSTER COMPUTING-THE JOURNAL OF NETWORKS SOFTWARE TOOLS AND APPLICATIONS,4,4,118,LOC,Code,traditional
53,An Approach for the Prediction of Number of Software Faults Based on the Dynamic Selection of Learning Techniques,Intra-release/Inter-release,defect-number,2019,IEEE TRANSACTIONS ON RELIABILITY,1,2,118,LOC,Code,traditional
54,The usefulness of software metric thresholds for detection of bad smells and fault prediction,Intra-release,defect-prone,2019,INFORMATION AND SOFTWARE TECHNOLOGY,2,2,118,LOC,Code,traditional
55,Majority Vote Feature Selection Algorithm in Software Fault Prediction,Intra-release,defect-prone,2019,COMPUTER SCIENCE AND INFORMATION SYSTEMS,4,4,118,LOC,Code,traditional
56,A fuzzy-filtered neuro-fuzzy framework for software fault prediction for inter-version and inter-project evaluation,Inter-release/Cross-project,defect-prone,2019,APPLIED SOFT COMPUTING,1,2,118,LOC,Code,traditional
58,An Empirical Study for Enhanced Software Defect Prediction Using a Learning-Based Framework,Intra-release,defect-prone,2019,INTERNATIONAL JOURNAL OF COMPUTATIONAL INTELLIGENCE SYSTEMS,3,4,118,LOC,Code,traditional
60,Performance and cost-effectiveness of change burst metrics in predicting software faults,Inter-release,defect-prone,2019,KNOWLEDGE AND INFORMATION SYSTEMS,3,4,118,LOC,Code,traditional
64,Understanding machine learning software defect predictions,Intra-release,defect-prone,2020,AUTOMATED SOFTWARE ENGINEERING,2,3,118,LOC,Code,traditional
67,Software Defect Prediction Based on Non-Linear Manifold Learning and Hybrid Deep Learning Techniques,Intra-release,defect-prone,2020,CMC-COMPUTERS MATERIALS & CONTINUA,3,4,118,LOC,Code,traditional
68,A Novel Feature Selection Method Based on Maximum Likelihood Logistic Regression for Imbalanced Learning in Software Defect Prediction,Intra-release,defect-prone,2020,INTERNATIONAL ARAB JOURNAL OF INFORMATION TECHNOLOGY,4,4,118,LOC,Code,traditional
69,Software Defect Prediction Based on Stacked Contractive Autoencoder and Multi-Objective Optimization,Intra-release,defect-prone,2020,CMC-COMPUTERS MATERIALS & CONTINUA,3,4,118,LOC,Code,traditional
71,Process metrics for software defect prediction in object-oriented programs,Inter-release,defect-prone,2020,IET SOFTWARE,3,4,118,LOC,Code,traditional
73,Cost-Sensitive and Sparse Ladder Network for Software Defect Prediction,Intra-release,defect-prone,2020,IEICE TRANSACTIONS ON INFORMATION AND SYSTEMS,4,4,118,LOC,Code,traditional
76,Boosted Whale Optimization Algorithm With Natural Selection Operators for Software Fault Prediction,Intra-release,defect-prone,2021,IEEE ACCESS,2,3,118,LOC,Code,traditional
77,Improved prediction of software defects using ensemble machine learning techniques,Intra-release,defect-prone,2021,NEURAL COMPUTING & APPLICATIONS,2,3,118,LOC,Code,traditional
79,Evaluating network embedding techniques' performances in software bug prediction,Intra-release,defect-prone,2021,EMPIRICAL SOFTWARE ENGINEERING,2,2,118,LOC,Code,traditional
81,Feature Selection Using Artificial Immune Network: An Approach for Software Defect Prediction,Intra-release,defect-prone,2021,INTELLIGENT AUTOMATION AND SOFT COMPUTING,3,4,118,LOC,Code,traditional
82,A Novel Rank Aggregation-Based Hybrid Multifilter Wrapper Feature Selection Method in Software Defect Prediction,Intra-release,defect-prone,2021,COMPUTATIONAL INTELLIGENCE AND NEUROSCIENCE,2,3,118,LOC,Code,traditional
83,Discriminating features-based cost-sensitive approach for software defect prediction,Intra-release,defect-prone,2021,AUTOMATED SOFTWARE ENGINEERING,2,3,118,LOC,Code,traditional
84,Analysis and modeling conditional mutual dependency of metrics in software defect prediction using latent variables,Inter-release/Cross-project,defect-prone,2021,NEUROCOMPUTING,2,2,118,LOC,Code,traditional
89,Research on Cross-Company Defect Prediction Method to Improve Software Security,Cross-project(Cross-company),defect-prone,2021,SECURITY AND COMMUNICATION NETWORKS,3,4,118,LOC,Code,traditional
91,RFC: a feature selection algorithm for software defect prediction,Intra-release,defect-prone,2021,JOURNAL OF SYSTEMS ENGINEERING AND ELECTRONICS,3,3,118,LOC,Code,traditional
92,Software Defect Prediction Based on Gated Hierarchical LSTMs,Inter-release,defect-prone,2021,IEEE TRANSACTIONS ON RELIABILITY,1,2,118,LOC,Code,traditional
95,Evaluating the impact of feature selection consistency in software prediction,Intra-release,defect-prone,2022,SCIENCE OF COMPUTER PROGRAMMING,4,4,118,LOC,Code,traditional
96,Software defect prediction based on stacked sparse denoising autoencoders and enhanced extreme learning machine,Intra-release,defect-prone,2022,IET SOFTWARE,3,4,118,LOC,Code,traditional
98,Software defect prediction with semantic and structural information of codes based on Graph Neural Networks,Intra-release/Inter-release/Cross-project,defect-prone,2022,INFORMATION AND SOFTWARE TECHNOLOGY,2,2,118,LOC,Code,traditional
100,Software defect prediction based on nested-stacking and heterogeneous feature selection,Inter-release/Cross-project,defect-prone,2022,COMPLEX & INTELLIGENT SYSTEMS,2,2,118,LOC,Code,traditional
101,A Comparative Analysis of SVM and ELM Classification on Software Reliability Prediction Model,Intra-release,defect-prone,2022,ELECTRONICS,2,3,118,LOC,Code,traditional
103,Defect prediction using deep learning with Network Portrait Divergence for software evolution,Intra-release/Cross-project,defect-prone/defect-number,2022,EMPIRICAL SOFTWARE ENGINEERING,2,2,118,LOC,Code,traditional
104,Genetic Evolution-Based Feature Selection for Software Defect Prediction Using SVMs,Intra-release,defect-prone,2022,JOURNAL OF CIRCUITS SYSTEMS AND COMPUTERS,4,4,118,LOC,Code,traditional
105,Research of Software Defect Prediction Model Based on Complex Network and Graph Neural Network,Intra-release,defect-prone,2022,ENTROPY,2,3,118,LOC,Code,traditional
106,Software fault prediction using evolving populations with mathematical diversification,Intra-release,defect-prone,2022,SOFT COMPUTING,2,3,118,LOC,Code,traditional
107,An Approach to Software Defect Prediction Combining Semantic Features and Code Changes,Inter-release,defect-prone,2022,INTERNATIONAL JOURNAL OF SOFTWARE ENGINEERING AND KNOWLEDGE ENGINEERING,4,4,118,LOC,Code,traditional
108,Improved mayfly optimization deep stacked sparse auto encoder feature selection scorched gradient descent driven dropout XLM learning framework for software defect prediction,Intra-release,defect-prone,2022,CONCURRENCY AND COMPUTATION-PRACTICE & EXPERIENCE,3,4,118,LOC,Code,traditional
115,A feature selection model for software defect prediction using binary Rao optimization algorithm,Intra-release,defect-prone,2022,APPLIED SOFT COMPUTING,1,2,118,LOC,Code,traditional
115,A feature selection model for software defect prediction using binary Rao optimization algorithm,Intra-release,defect-prone,2022,APPLIED SOFT COMPUTING,1,2,118,LOC,Code,traditional
117,An Optimized Feature Selection Method Using Ensemble Classifiers in Software Defect Prediction for Healthcare Systems,Intra-release,defect-prone,2022,WIRELESS COMMUNICATIONS & MOBILE COMPUTING,3,4,118,LOC,Code,traditional
117,An Optimized Feature Selection Method Using Ensemble Classifiers in Software Defect Prediction for Healthcare Systems,Intra-release,defect-prone,2022,WIRELESS COMMUNICATIONS & MOBILE COMPUTING,3,4,118,LOC,Code,traditional
123,Software Defect Prediction via GCN based on Structural and Context Information,Inter-release,defect-prone,2022,2022 9th International Conference on Dependable Systems and Their Applications (DSA),0,0,118,LOC,Code,traditional
124,Performance Analysis of Feature Selection Techniques in Software Defect Prediction using Machine Learning,Intra-release,defect-prone,2022,"2022 International Conference on Advancements in Smart, Secure and Intelligent Computing (ASSIC)",0,0,118,LOC,Code,traditional
127,Search-based Feature Selection for Cross-Project Fault Prediction,Cross-project,defect-prone,2022,2022 IEEE Pune Section International Conference (PuneCon),0,0,118,LOC,Code,traditional
138,DNNAttention: A deep neural network and attention based architecture for cross project defect number prediction,Cross-project,defect-number,2021,Knowledge-Based Systems,0,0,118,LOC,Code,traditional
139,Joint feature representation learning and progressive distribution matching for cross-project defect prediction,Cross-project,defect-prone,2021,Information and Software Technology,0,0,118,LOC,Code,traditional
142,An Empirical Study on The Impact of The Interaction between Feature Selection and Sampling in Defect Prediction,Intra-release,defect-prone,2020,2020 7th International Conference on Dependable Systems and Their Applications (DSA),0,0,118,LOC,Code,traditional
146,Deep learning based software defect prediction,Intra-release,defect-number,2020,Neurocomputing,0,0,118,LOC,Code,traditional
149,An Abstract Syntax Tree Encoding Method for Cross-Project Defect Prediction,Cross-project,defect-prone,2019,IEEE Access,0,0,118,LOC,Code,traditional
154,The Impact of Feature Selection on Defect Prediction Performance: An Empirical Comparison,Intra-release,defect-prone,2016,2016 IEEE 27th International Symposium on Software Reliability Engineering (ISSRE),0,0,118,LOC,Code,traditional
156,"How, and why, process metrics are better",Inter-release,defect-prone,2013,2013 35th International Conference on Software Engineering (ICSE),0,0,118,LOC,Code,traditional
157,Evaluating Performance of Network Metrics for Bug Prediction in Software,Inter-release/Cross-project,defect-prone,2013,2013 20th Asia-Pacific Software Engineering Conference (APSEC),0,0,118,LOC,Code,traditional
1,Predicting aging-related bugs using software complexity metrics,Inter-release,defect-prone,2013,PERFORMANCE EVALUATION,3,4,61,N1,Halstead,traditional
2,Influence of confirmation biases of developers on software quality: an empirical study,Inter-release,defect-density,2013,SOFTWARE QUALITY JOURNAL,3,4,61,N1,Halstead,traditional
5,A STUDY OF SOFTWARE METRIC SELECTION TECHNIQUES: STABILITY ANALYSIS AND DEFECT PREDICTION MODEL PERFORMANCE,Inter-release,defect-prone,2013,INTERNATIONAL JOURNAL ON ARTIFICIAL INTELLIGENCE TOOLS,4,4,61,N1,Halstead,traditional
7,Two-Stage Cost-Sensitive Learning for Software Defect Prediction,Intra-release,defect-prone,2014,IEEE TRANSACTIONS ON RELIABILITY,1,2,61,N1,Halstead,traditional
14,Improving Recall of software defect prediction models using association mining,Intra-release,defect-prone,2015,KNOWLEDGE-BASED SYSTEMS,1,1,61,N1,Halstead,traditional
25,Empirical analysis of network measures for predicting high severity software faults,Inter-release/Cross-project,defect-prone,2016,SCIENCE CHINA-INFORMATION SCIENCES,1,2,61,N1,Halstead,traditional
27,SAMPLING IMBALANCE DATASET FOR SOFTWARE DEFECT PREDICTION USING HYBRID NEURO-FUZZY SYSTEMS WITH NAIVE BAYES CLASSIFIER,Intra-release,defect-prone,2016,TEHNICKI VJESNIK-TECHNICAL GAZETTE,4,4,61,N1,Halstead,traditional
28,Empirical Studies of a Two-Stage Data Preprocessing Approach for Software Fault Prediction,Intra-release,defect-prone,2016,IEEE TRANSACTIONS ON RELIABILITY,1,2,61,N1,Halstead,traditional
31,A Combined-Learning Based Framework for Improved Software Fault Prediction,Intra-release,defect-prone,2017,INTERNATIONAL JOURNAL OF COMPUTATIONAL INTELLIGENCE SYSTEMS,3,4,61,N1,Halstead,traditional
32,A feature selection approach based on a similarity measure for software defect prediction,Intra-release,defect-prone,2017,FRONTIERS OF INFORMATION TECHNOLOGY & ELECTRONIC ENGINEERING,2,3,61,N1,Halstead,traditional
38,A Framework for Software Defect Prediction and Metric Selection,Intra-release,defect-prone,2018,IEEE ACCESS,2,3,61,N1,Halstead,traditional
44,Deep neural network based hybrid approach for software defect prediction using software metrics,Intra-release,defect-prone,2019,CLUSTER COMPUTING-THE JOURNAL OF NETWORKS SOFTWARE TOOLS AND APPLICATIONS,2,4,61,N1,Halstead,traditional
48,Software defect prediction techniques using metrics based on neural network classifier,Intra-release,defect-prone,2019,CLUSTER COMPUTING-THE JOURNAL OF NETWORKS SOFTWARE TOOLS AND APPLICATIONS,2,4,61,N1,Halstead,traditional
49,Performance Analysis of Feature Selection Methods in Software Defect Prediction: A Search Method Approach,Intra-release,defect-prone,2019,APPLIED SCIENCES-BASEL,2,4,61,N1,Halstead,traditional
52,Feature selection using firefly algorithm in software defect prediction,Intra-release,defect-prone,2019,CLUSTER COMPUTING-THE JOURNAL OF NETWORKS SOFTWARE TOOLS AND APPLICATIONS,4,4,61,N1,Halstead,traditional
55,Majority Vote Feature Selection Algorithm in Software Fault Prediction,Intra-release,defect-prone,2019,COMPUTER SCIENCE AND INFORMATION SYSTEMS,4,4,61,N1,Halstead,traditional
58,An Empirical Study for Enhanced Software Defect Prediction Using a Learning-Based Framework,Intra-release,defect-prone,2019,INTERNATIONAL JOURNAL OF COMPUTATIONAL INTELLIGENCE SYSTEMS,3,4,61,N1,Halstead,traditional
59,A Hybrid Feature Selection Method for Software Fault Prediction,Intra-release,defect-prone,2019,IEICE TRANSACTIONS ON INFORMATION AND SYSTEMS,4,4,61,N1,Halstead,traditional
68,A Novel Feature Selection Method Based on Maximum Likelihood Logistic Regression for Imbalanced Learning in Software Defect Prediction,Intra-release,defect-prone,2020,INTERNATIONAL ARAB JOURNAL OF INFORMATION TECHNOLOGY,4,4,61,N1,Halstead,traditional
69,Software Defect Prediction Based on Stacked Contractive Autoencoder and Multi-Objective Optimization,Intra-release,defect-prone,2020,CMC-COMPUTERS MATERIALS & CONTINUA,3,4,61,N1,Halstead,traditional
77,Improved prediction of software defects using ensemble machine learning techniques,Intra-release,defect-prone,2021,NEURAL COMPUTING & APPLICATIONS,2,3,61,N1,Halstead,traditional
81,Feature Selection Using Artificial Immune Network: An Approach for Software Defect Prediction,Intra-release,defect-prone,2021,INTELLIGENT AUTOMATION AND SOFT COMPUTING,3,4,61,N1,Halstead,traditional
82,A Novel Rank Aggregation-Based Hybrid Multifilter Wrapper Feature Selection Method in Software Defect Prediction,Intra-release,defect-prone,2021,COMPUTATIONAL INTELLIGENCE AND NEUROSCIENCE,2,3,61,N1,Halstead,traditional
83,Discriminating features-based cost-sensitive approach for software defect prediction,Intra-release,defect-prone,2021,AUTOMATED SOFTWARE ENGINEERING,2,3,61,N1,Halstead,traditional
84,Analysis and modeling conditional mutual dependency of metrics in software defect prediction using latent variables,Inter-release/Cross-project,defect-prone,2021,NEUROCOMPUTING,2,2,61,N1,Halstead,traditional
89,Research on Cross-Company Defect Prediction Method to Improve Software Security,Cross-project(Cross-company),defect-prone,2021,SECURITY AND COMMUNICATION NETWORKS,3,4,61,N1,Halstead,traditional
91,RFC: a feature selection algorithm for software defect prediction,Intra-release,defect-prone,2021,JOURNAL OF SYSTEMS ENGINEERING AND ELECTRONICS,3,3,61,N1,Halstead,traditional
96,Software defect prediction based on stacked sparse denoising autoencoders and enhanced extreme learning machine,Intra-release,defect-prone,2022,IET SOFTWARE,3,4,61,N1,Halstead,traditional
101,A Comparative Analysis of SVM and ELM Classification on Software Reliability Prediction Model,Intra-release,defect-prone,2022,ELECTRONICS,2,3,61,N1,Halstead,traditional
102,A software defect prediction method with metric compensation based on feature selection and transfer learning,Cross-project,defect-prone,2022,FRONTIERS OF INFORMATION TECHNOLOGY & ELECTRONIC ENGINEERING,2,3,61,N1,Halstead,traditional
104,Genetic Evolution-Based Feature Selection for Software Defect Prediction Using SVMs,Intra-release,defect-prone,2022,JOURNAL OF CIRCUITS SYSTEMS AND COMPUTERS,4,4,61,N1,Halstead,traditional
106,Software fault prediction using evolving populations with mathematical diversification,Intra-release,defect-prone,2022,SOFT COMPUTING,2,3,61,N1,Halstead,traditional
108,Improved mayfly optimization deep stacked sparse auto encoder feature selection scorched gradient descent driven dropout XLM learning framework for software defect prediction,Intra-release,defect-prone,2022,CONCURRENCY AND COMPUTATION-PRACTICE & EXPERIENCE,3,4,61,N1,Halstead,traditional
110,A novel multi-view ordinal classification approach for software bug prediction,Intra-release,defect-prone,2022,EXPERT SYSTEMS,2,4,61,N1,Halstead,traditional
111,Causally Remove Negative Confound Effects of Size Metric for Software Defect Prediction,Intra-release,defect-prone,2022,APPLIED SCIENCES-BASEL,2,4,61,N1,Halstead,traditional
115,A feature selection model for software defect prediction using binary Rao optimization algorithm,Intra-release,defect-prone,2022,APPLIED SOFT COMPUTING,1,2,61,N1,Halstead,traditional
122,Combining Deep Learning and Kernel PCA for Software Defect Prediction,Intra-release,defect-prone,2022,Association for Computing Machinery,0,0,61,N1,Halstead,traditional
124,Performance Analysis of Feature Selection Techniques in Software Defect Prediction using Machine Learning,Intra-release,defect-prone,2022,"2022 International Conference on Advancements in Smart, Secure and Intelligent Computing (ASSIC)",0,0,61,N1,Halstead,traditional
125,Software Defect Density Prediction Using Deep Learning,Cross-project,defect-density,2022,IEEE Access,0,0,61,N1,Halstead,traditional
127,Search-based Feature Selection for Cross-Project Fault Prediction,Cross-project,defect-prone,2022,2022 IEEE Pune Section International Conference (PuneCon),0,0,61,N1,Halstead,traditional
142,An Empirical Study on The Impact of The Interaction between Feature Selection and Sampling in Defect Prediction,Intra-release,defect-prone,2020,2020 7th International Conference on Dependable Systems and Their Applications (DSA),0,0,61,N1,Halstead,traditional
146,Deep learning based software defect prediction,Intra-release,defect-number,2020,Neurocomputing,0,0,61,N1,Halstead,traditional
154,The Impact of Feature Selection on Defect Prediction Performance: An Empirical Comparison,Intra-release,defect-prone,2016,2016 IEEE 27th International Symposium on Software Reliability Engineering (ISSRE),0,0,61,N1,Halstead,traditional
1,Predicting aging-related bugs using software complexity metrics,Inter-release,defect-prone,2013,PERFORMANCE EVALUATION,3,4,62,N2,Halstead,traditional
2,Influence of confirmation biases of developers on software quality: an empirical study,Inter-release,defect-density,2013,SOFTWARE QUALITY JOURNAL,3,4,62,N2,Halstead,traditional
5,A STUDY OF SOFTWARE METRIC SELECTION TECHNIQUES: STABILITY ANALYSIS AND DEFECT PREDICTION MODEL PERFORMANCE,Inter-release,defect-prone,2013,INTERNATIONAL JOURNAL ON ARTIFICIAL INTELLIGENCE TOOLS,4,4,62,N2,Halstead,traditional
